{
  "$schema": "../../../templates/part.schema.json",
  "kind": "part",
  "id": "motor_dc_gear_12v",
  "name": "DC gear motor (37 mm, 12 V)",
  "category": "actuator",
  "description": "A 37 mm metal gear motor (JGB37-520 class): 6-12 V, about 300 mA running, 3 A stalled.",
  "tags": [
    "motor",
    "dc",
    "gear",
    "12v"
  ],
  "device": {
    "type": "dc_motor",
    "preset": "gear_12v"
  },
  "size_mm": {
    "w": 82,
    "h": 45
  },
  "nets": [
    {
      "id": "motor",
      "label": "Motor",
      "role": "sink",
      "voltage_mV": {
        "min": 6000,
        "max": 12000,
        "nominal": 12000
      },
      "current_mA": {
        "typical": 300,
        "peak": 3000
      }
    }
  ],
  "connectors": [
    {
      "id": "leads",
      "label": "Motor leads",
      "type": "wire",
      "rotation": 0,
      "from": {
        "x": 70,
        "y": 18.5
      },
      "at": {
        "x": 72,
        "y": 42
      },
      "pins": [
        {
          "id": "a",
          "label": "M+",
          "color": "#d7263d",
          "motor": "a"
        },
        {
          "id": "b",
          "label": "M-",
          "color": "#1d1f22",
          "motor": "b"
        }
      ]
    }
  ],
  "graphic": "part.svg"
}